{
  "id": "bubble-courier",
  "name": "泡泡邮差",
  "version": 1,
  "rarity": "common",
  "tags": ["mobility", "pickup", "intermediate"],
  "description": "穿梭在糖果王国邮路上的泡泡邮差，擅长高速移动和捡取糖晶。",
  "base_stats": {
    "max_health": 100,
    "move_speed": 205,
    "pickup_radius": 88,
    "damage_multiplier": 0.95,
    "cooldown_multiplier": 0.98,
    "xp_multiplier": 1.08,
    "regen_per_second": 0.0
  },
  "initial_loadout": {
    "weapons": ["soda-bubble-pop"],
    "passives": []
  },
  "trait": {
    "id": "bubble-runner",
    "description": "移动后短时间提升拾取范围。",
    "rules": []
  },
  "visual_description": "戴邮差帽的蓝粉泡泡角色，斜挎糖信包，鞋底冒泡。",
  "sfx_description": "轻快泡泡脚步声和小铃铛提示音。",
  "unlock": {
    "type": "default"
  }
}
